'Thị trường bất động sản lúc nóng sốt như cơn lũ quét'|https://vnexpress.net/thi-truong-bat-dong-san-luc-nong-sot-nhu-con-lu-quet-4473748.html|https://i1-kinhdoanh.vnecdn.net/2022/06/09/aToan1-1654743897-1265-1654743994.jpg?w=220&h=132&q=100&dpr=1&fit=crop&s=_mrDbxyTSMdRgJ7KmaGsdA|Nhà sáng lập EZ Property cho rằng, khi thị trường sốt, loại đất nông nghiệp, vườn, thậm chí đất không có giấy tờ cũng được đem ra giao dịch.|kinh tế|vnexpress.net|unknow
AI giúp gì cho ngành vận tải?|https://vnexpress.net/ai-giup-gi-cho-nganh-van-tai-4471333.html|https://i1-kinhdoanh.vnecdn.net/2022/06/02/cccc-1654166221-7581-1654166367.png?w=220&h=132&q=100&dpr=1&fit=crop&s=W-oK1XbYzRMMF1KQB8UQeA|Khi được AI hỗ trợ, ngành vận tải và logistics sẽ tối ưu hóa được chuỗi cung ứng, nâng cao tính bền vững và tăng hiệu quả giao thông công cộng.|kinh tế|vnexpress.net|unknow
The Next Power khám phá sức mạnh sáng tạo của doanh nghiệp|https://video.vnexpress.net/tin-tuc/the-next-power/the-next-power-kham-pha-suc-manh-sang-tao-cua-doanh-nghiep-4473976.html|https://i1-kinhdoanh.vnecdn.net/2022/06/09/ThumbnailTNPtap5-1654742143-8652-1654742208.png?w=220&h=132&q=100&dpr=1&fit=crop&s=NO87LwWjgNA_b3zNXiP44A|Sức mạnh sáng tạo là chìa khoá làm nên thành công của đổi mới, quan điểm này đã được lãnh đạo các doanh nghiệp nhấn mạnh trong talkshow The Next Power.|kinh tế|vnexpress.net|unknow
eWork ưu đãi tới 50% gói tuyển dụng AI|https://vnexpress.net/ework-uu-dai-toi-50-goi-tuyen-dung-ai-4473960.html|https://i1-vnexpress.vnecdn.net/2022/06/09/eWorkLaunchingPromotion-165474-2755-5754-1654742923.jpg?w=220&h=132&q=100&dpr=1&fit=crop&s=0uV8ppm70wVQ2xFYtfyzUA|Nền tảng việc Làm của VnExpress khuyến mãi thêm 50% số lượng credit với tất cả gói dịch vụ.|kinh tế|vnexpress.net|unknow
Chủ tịch Aura Capital chia sẻ kinh nghiệm chuẩn bị IPO cho SMEs|https://vnexpress.net/chu-tich-aura-capital-chia-se-kinh-nghiem-chuan-bi-ipo-cho-smes-4472648.html|https://i1-kinhdoanh.vnecdn.net/2022/06/08/2-1654674389-6606-1654675099.jpg?w=220&h=132&q=100&dpr=1&fit=crop&s=Ja7dP_qAcJKAZN957qb-3A|Với phương pháp cơ chế vốn, ông Đậu Minh Nhật, Chủ tịch Aura Capital đã giúp hơn 30 SMEs tái cấu trúc, thiết kế chiến lược trước khi IPO và thu hút nhà đầu tư.|kinh tế|vnexpress.net|unknow
Lý do người Nhật coi trọng nghệ thuật chăm sóc khách hàng Omotenashi|https://vnexpress.net/ly-do-nguoi-nhat-coi-trong-nghe-thuat-cham-soc-khach-hang-omotenashi-4472725.html|https://i1-kinhdoanh.vnecdn.net/2022/06/07/Image-204739839-ExtractWord-0-3650-1588-1654574267.png?w=220&h=132&q=100&dpr=1&fit=crop&s=y7aGwKonMuC9p75UOKYWeA|Nhiều doanh nghiệp trên thế giới và Việt Nam áp dụng nghệ thuật này trong kinh doanh nhằm tối ưu hóa trải nghiệm khách hàng.|kinh tế|vnexpress.net|unknow
Các chủ hàng mất 10 tỷ USD trong đại dịch|https://vnexpress.net/cac-chu-hang-mat-10-ty-usd-trong-dai-dich-4472859.html|https://i1-kinhdoanh.vnecdn.net/2022/06/06/longbeachport780x470-165451128-2079-8455-1654511846.jpg?w=220&h=132&q=100&dpr=1&fit=crop&s=63cfLGljyxznGNZpkIR23w|Dịch bệnh khiến nhiều tàu cập cảng muộn nhiều tuần, gây tổn thất hàng chục tỷ USD, theo báo cáo của Sea-Intelligence.|kinh tế|vnexpress.net|unknow
Chính phủ khuyến khích mua bán, sáp nhập ngân hàng|https://vnexpress.net/khuyen-khich-mua-ban-sap-nhap-ngan-hang-4473840.html|https://i1-kinhdoanh.vnecdn.net/2022/06/08/bank15734701111135157347040455-8697-6402-1654702077.jpg?w=220&h=132&q=100&dpr=1&fit=crop&s=g5MS2qv2Zt8ReqfHbmUT9g|Giai đoạn 2021-2025, Chính phủ khuyến khích các nhà băng tự nguyện mua bán, hợp nhất, sáp nhập để gia tăng quy mô, phạm vi hoạt động, khả năng cạnh tranh.|kinh tế|vnexpress.net|unknow
Chủ tịch Quốc hội: 'Siết thị trường bất động sản chứ đừng hạn chế nó phát triển'|https://vnexpress.net/chu-tich-quoc-hoi-siet-thi-truong-bat-dong-san-chu-dung-han-che-no-phat-trien-4473745.html|https://i1-kinhdoanh.vnecdn.net/2022/06/08/chu-tich-vuong-dinh-hue-165468-9429-4651-1654684771.jpg?w=220&h=132&q=100&dpr=1&fit=crop&s=XdJ7p1wvMhW0EgEGPgZ6CQ|"Chủ tịch Quốc hội Vương Đình Huệ lưu ý, một mặt giám sát, xử lý ""những méo mó"" như vừa qua nhưng mặt khác cũng cần tạo điều kiện cho thị trường phát triển."|kinh tế|vnexpress.net|unknow
'Hiện chỉ Tân Hoàng Minh chưa trả được nợ phát hành trái phiếu'|https://vnexpress.net/hien-chi-tan-hoang-minh-chua-tra-duoc-no-phat-hanh-trai-phieu-4473629-tong-thuat.html|https://i1-kinhdoanh.vnecdn.net/2022/06/08/HoDucPhoc4-1654671462-9439-1654671618.jpg?w=220&h=132&q=100&dpr=1&fit=crop&s=-lszyrvPOwcns8clHJSl6w|Trước băn khoăn về khả năng trả nợ của 51 tỷ USD trái phiếu doanh nghiệp đã phát hành, Bộ trưởng Hồ Đức Phớc cho biết mới có Tân Hoàng Minh chưa trả được nợ, còn lại vẫn bình thường.|kinh tế|vnexpress.net|unknow
Đổ xô mua Bitcoin khi thị trường tiền số giảm sâu|https://vnexpress.net/do-xo-mua-bitcoin-khi-thi-truong-tien-so-giam-sau-4473534.html|https://i1-kinhdoanh.vnecdn.net/2022/06/08/0x0-1654659368-3268-1654660883.jpg?w=220&h=132&q=100&dpr=1&fit=crop&s=at1UsImQCU-3UfAtRMJLPw|Khi thị trường vào chu kỳ giảm sâu, nhiều người bán bớt các tiền số khác và mua Bitcoin với tốc độ cao nhất gần một năm qua.|kinh tế|vnexpress.net|unknow
Bất động sản 'khát vốn'|https://vnexpress.net/bat-dong-san-khat-von-4473392.html|https://i1-kinhdoanh.vnecdn.net/2022/06/08/EBB7F303F43867BD992093DA33C62F-6297-4238-1654621970.jpg?w=220&h=132&q=100&dpr=1&fit=crop&s=B1u_6NA4SjLcn_Op6XBEKQ|Một số doanh nghiệp địa ốc cho biết bất ngờ bị dừng giải ngân vì ngân hàng hết room cho vay, trong khi nhiều người mua nhà khó tiếp cận vốn tín dụng.|kinh tế|vnexpress.net|unknow
VN-Index vượt 1.300 điểm|https://vnexpress.net/vn-index-vuot-1-300-diem-4473769.html|https://i1-kinhdoanh.vnecdn.net/2022/06/08/CG2A9257-1654682461-5361-1654682482.jpg?w=220&h=132&q=100&dpr=1&fit=crop&s=60AiGnawixOskfnq4i7Iig|Chứng khoán tăng phiên thứ ba liên tiếp với chỉ số của sàn HoSE vượt ngưỡng 1.300 điểm nhờ sắc xanh lan rộng toàn thị trường.|kinh tế|vnexpress.net|unknow
Lạm phát tăng mạnh ở các nước Đông Nam Á|https://vnexpress.net/lam-phat-tang-manh-o-cac-nuoc-dong-nam-a-4473527.html|https://i1-kinhdoanh.vnecdn.net/2022/06/08/md-shop1-08062022-jpeg-1654665-6949-4836-1654665675.jpg?w=220&h=132&q=100&dpr=1&fit=crop&s=xcTionu15GjEnAgMQVVunQ|Giá đầu vào, như lương thực hay nhiên liệu, tăng cao khiến lạm phát ở một số nước Đông Nam Á phá kỷ lục.|kinh tế|vnexpress.net|unknow
Rau quả xuất sang Trung Quốc giảm mạnh|https://vnexpress.net/rau-qua-xuat-sang-trung-quoc-giam-manh-4473575.html|https://i1-kinhdoanh.vnecdn.net/2022/06/08/img-2615-jpg-1654667815-5939-1654668147.jpg?w=220&h=132&q=100&dpr=1&fit=crop&s=TgMGAZz3x5kxhOK-ZcDmYg|Bốn tháng đầu năm, xuất khẩu rau quả sang Trung Quốc đạt 625 triệu USD, giảm 28% so với cùng kỳ năm ngoái.|kinh tế|vnexpress.net|unknow
Bộ trưởng Tài chính: Thất thu thuế rất lớn từ thương mại điện tử|https://vnexpress.net/bo-truong-tai-chinh-that-thu-thue-rat-lon-tu-thuong-mai-dien-tu-4473612.html|https://i1-kinhdoanh.vnecdn.net/2022/06/08/1hoducphoc84871654656982-16546-8554-6671-1654677552.jpg?w=220&h=132&q=100&dpr=1&fit=crop&s=d2efqvwpdDe1konWuF0ZpQ|Bộ trưởng Hồ Đức Phớc cho rằng thu thuế trên các nền tảng số là lĩnh vực rất mới và hiện thất thu lớn với sàn thương mại điện tử, kinh doanh công nghệ.|kinh tế|vnexpress.net|unknow
Chanh leo Việt Nam được xuất khẩu sang Trung Quốc|https://vnexpress.net/chanh-leo-viet-nam-duoc-xuat-khau-sang-trung-quoc-4473624.html|https://i1-kinhdoanh.vnecdn.net/2022/06/08/chanh-leo-jpeg-1654671709-1762-1654671916.jpg?w=220&h=132&q=100&dpr=1&fit=crop&s=aFyu4e3mZmbSKi8jjdVpeg|Trung Quốc vừa chấp thuận cho chanh leo Việt Nam xuất khẩu sang thị trường này sau thời gian dài đàm phán.|kinh tế|vnexpress.net|unknow
Thống đốc bị chất vấn về cấp hạn mức tín dụng cho ngân hàng|https://vnexpress.net/thong-doc-ngan-hang-nha-nuoc-tra-loi-chat-van-quoc-hoi-chieu-8-6-4473663-tong-thuat.html|https://i1-kinhdoanh.vnecdn.net/2022/06/08/ThongdocNguyenThiHong3-1654686-6334-2609-1654686780.jpg?w=220&h=132&q=100&dpr=1&fit=crop&s=I0kzu0K22jntMbKwVxwO-w|"Đại biểu Quốc hội chất vấn tính hợp lý của việc cấp ""room"" tín dụng và cho rằng biện pháp này mang dáng dấp ""bao cấp"", can thiệp vào hoạt động của các nhà băng."|kinh tế|vnexpress.net|unknow
Cổ phần hoá doanh nghiệp 'tắc' vì đất đai|https://vnexpress.net/co-phan-hoa-doanh-nghiep-tac-vi-dat-dai-4473566.html|https://i1-kinhdoanh.vnecdn.net/2022/06/08/cong-ninh-binh-jpeg-4741-16546-2641-5535-1654674319.jpg?w=220&h=132&q=100&dpr=1&fit=crop&s=QoLzfR0GmZTDB4c20qlkTg|Bộ trưởng Tài chính Hồ Đức Phớc đánh giá, cốt lõi chậm cổ phần hóa là do vướng mắc chuyển mục đích sử dụng đất và thất thoát thường xảy ra ở đây.|kinh tế|vnexpress.net|unknow
World Bank: 'Nhiều nước khó thoát suy thoái'|https://vnexpress.net/world-bank-nhieu-nuoc-kho-thoat-suy-thoai-4473485.html|https://i1-kinhdoanh.vnecdn.net/2022/06/08/US-1654660160-3812-1654660194.jpg?w=220&h=132&q=100&dpr=1&fit=crop&s=-55lStq5GmlLltNVho2t3g|Các thách thức từ Nga - Ukraine, Trung Quốc, lạm phát khiến Ngân hàng Thế giới bi quan về kinh tế toàn cầu.|kinh tế|vnexpress.net|unknow
Bộ trưởng Tài chính: 'Đã nỗ lực cảnh báo rủi ro trái phiếu doanh nghiệp'|https://vnexpress.net/bo-truong-tai-chinh-ho-duc-phoc-tra-loi-chat-van-sang-8-6-4473438-tong-thuat.html|https://i1-kinhdoanh.vnecdn.net/2022/06/08/HoDucPhoc2-1654650306-3071-1654650342.jpg?w=220&h=132&q=100&dpr=1&fit=crop&s=jfaQUP5Xcwoc7ePu9mcWgA|"Khi được hỏi về trách nhiệm với sai phạm gần đây trên thị trường, Bộ trưởng Hồ Đức Phớc nói ""đã nhiều lần nỗ lực"" cảnh báo rủi ro tới các nhà đầu tư, doanh nghiệp."|kinh tế|vnexpress.net|unknow
Hôm nay Bộ trưởng Tài chính, Thống đốc Ngân hàng Nhà nước trả lời chất vấn|https://vnexpress.net/hom-nay-bo-truong-tai-chinh-thong-doc-ngan-hang-nha-nuoc-tra-loi-chat-van-4473376.html|https://i1-kinhdoanh.vnecdn.net/2022/06/08/HaiBotruong-1654649575-5469-1654649580.jpg?w=220&h=132&q=100&dpr=1&fit=crop&s=HWgJw7CZsDGlPB7Hc5_OsA|Các vấn đề nóng về chứng khoán, trái phiếu, kiểm soát tín dụng vào lĩnh vực rủi ro... sẽ được Bộ trưởng Tài chính và Thống đốc Ngân hàng Nhà nước giải trình ngày 8/6.|kinh tế|vnexpress.net|unknow
Tiềm năng kinh doanh của nhà phố thương mại tại Sun Beauty Onsen|https://vnexpress.net/tiem-nang-kinh-doanh-cua-nha-pho-thuong-mai-tai-sun-beauty-onsen-4473569.html|https://i1-kinhdoanh.vnecdn.net/2022/06/08/Image-ExtractWord-0-Out-3551-1654663549.png?w=220&h=132&q=100&dpr=1&fit=crop&s=R_ISHdZQsgHy17leSU83zw|THANH HÓA Phân khu Koto nằm tại trung tâm quần thể nghỉ dưỡng khoáng nóng Sun Beauty Onsen, vừa có tiềm năng thương mại, vừa là tài sản cho nhà đầu tư.|kinh tế|vnexpress.net|unknow
7 cách để giảm phát thải trong hoạt động logistics|https://vnexpress.net/7-cach-de-giam-phat-thai-trong-hoat-dong-logistics-4472723.html|https://i1-kinhdoanh.vnecdn.net/2022/06/06/0x0-1654480843-6797-1654500180.jpg?w=220&h=132&q=100&dpr=1&fit=crop&s=-rtdfoRLoS4D5imSnw-nCg|Tham gia nền kinh tế tuần hoàn, giải quyết thách thức giao hàng chặng cuối,... là các giải pháp giảm phát thải trong hoạt động logistics, theo Forbes.|kinh tế|vnexpress.net|unknow
The Sailing Bay - Phân khu biểu tượng tại Hon Thom Paradise Island|https://vnexpress.net/the-sailing-bay-phan-khu-bieu-tuong-tai-hon-thom-paradise-island-4463327.html|https://i1-kinhdoanh.vnecdn.net/2022/06/08/Settop1-1654654244-4526-1654654740.jpg?w=220&h=132&q=100&dpr=1&fit=crop&s=poJNyRI_95oonjI2efy_jg|Sở hữu tòa nhà Cánh Buồm, hệ thống bất động sản sang trọng, The Sailing Bay hứa hẹn là tọa độ sôi động với đa trải nghiệm và dòng chảy thương mại thịnh vượng.|kinh tế|vnexpress.net|unknow
VietCredit cho vay tiêu dùng qua bưu điện Việt Nam|https://vnexpress.net/vietcredit-cho-vay-tieu-dung-qua-buu-dien-viet-nam-4473267.html|https://i1-kinhdoanh.vnecdn.net/2022/06/08/1-1654592298-1654592313-1718-1654650290.jpg?w=220&h=132&q=100&dpr=1&fit=crop&s=6YUOWTzWFi-96GHDVdvPcA|VietCredit mở rộng kênh phân phối sản phẩm tài chính thông qua thiết bị mở thẻ tín dụng nội địa trực tuyến đặt tại mạng lưới bưu điện Việt Nam.|kinh tế|vnexpress.net|unknow
Hệ sinh thái công nghệ thông minh tại FWD Việt Nam|https://vnexpress.net/he-sinh-thai-cong-nghe-thong-minh-tai-fwd-viet-nam-4472843.html|https://i1-kinhdoanh.vnecdn.net/2022/06/07/set-1654597170-1654597177-3134-1654597479.png?w=220&h=132&q=100&dpr=1&fit=crop&s=0c2g7nrqzf5199KetOI_-w|FWD xây dựng hệ sinh thái công nghệ thông minh tương thích nhu cầu từng khách hàng nhờ ứng dụng trí tuệ nhân tạo, công nghệ voicebot, dữ liệu lớn, điện toán đám mây.|kinh tế|vnexpress.net|unknow
Giá gà lông màu tăng gấp đôi|https://vnexpress.net/gia-ga-long-mau-tang-gap-doi-4473228.html|https://i1-kinhdoanh.vnecdn.net/2022/06/07/ga-jpeg-1654589447-6464-1654590365.jpg?w=220&h=132&q=100&dpr=1&fit=crop&s=XvsYLTgRzaPz2yIeSBI1WA|Giá gà lông màu tại trang trại đang ở mức 59.000-60.000 đồng một kg, tăng gấp đôi cùng kỳ năm ngoái.|kinh tế|vnexpress.net|unknow
Cổ phiếu liên quan đến FLC giảm sàn liên tiếp|https://vnexpress.net/co-phieu-lien-quan-den-flc-giam-san-lien-tiep-4473301.html|https://i1-kinhdoanh.vnecdn.net/2022/06/07/chungkhoan1-1654595130-6508-1654595139.jpg?w=220&h=132&q=100&dpr=1&fit=crop&s=lpwUPzSuEf0u2QLOYowblw|FLC, HAI, ROS liên tiếp giảm khi bị cấm giao dịch buổi sáng từ 1/6, trong đó hai phiên gần nhất mất hết biên độ và không có bên mua.|kinh tế|vnexpress.net|unknow
Rủi ro tiềm ẩn sau hai năm bùng nổ trái phiếu doanh nghiệp|https://vnexpress.net/rui-ro-tiem-an-sau-hai-nam-bung-no-trai-phieu-doanh-nghiep-4472919.html|https://i1-kinhdoanh.vnecdn.net/2022/06/07/bdsquynhtran-1654589687-9643-1654589726.jpg?w=220&h=132&q=100&dpr=1&fit=crop&s=kJsZd8PVV-bbgK-Nzj0eew|Lách quy định để mua bán trái phiếu riêng lẻ; phát hành trái phiếu khi thua lỗ, có hệ số nợ gấp hàng chục lần vốn chủ sở hữu... là những gì diễn ra trên thị trường trái phiếu.|kinh tế|vnexpress.net|unknow
Người dân các nước được sở hữu chung cư bao nhiêu năm?|https://vnexpress.net/nguoi-dan-cac-nuoc-duoc-so-huu-chung-cu-bao-nhieu-nam-4472922.html|https://i1-kinhdoanh.vnecdn.net/2022/06/07/china-cc-jpeg-1654545152-16545-6717-9409-1654545668.jpg?w=220&h=132&q=100&dpr=1&fit=crop&s=N19KwmMA1rVHLQ9CFk9Jyw|Trung Quốc cho phép sở hữu căn hộ tối đa 70 năm, Singapore quy định thời hạn là 99 năm, còn Thái Lan thông thường là 30 năm.|kinh tế|vnexpress.net|unknow
Sếp Gojek từ nhiệm sau thương vụ niêm yết tỷ USD|https://vnexpress.net/sep-gojek-tu-nhiem-sau-thuong-vu-niem-yet-ty-usd-4473289.html|https://i1-kinhdoanh.vnecdn.net/2022/06/07/1400x-1-jpeg-1654593941-8424-1654593977.jpg?w=220&h=132&q=100&dpr=1&fit=crop&s=MoFOQp3LnSY4h_QZ32mtpw|Kevin Aluwi từ chức CEO sau khi giúp Gojek sáp nhập với Tokopedia và lên sàn thành công với định giá tỷ USD.|kinh tế|vnexpress.net|unknow
Lạm phát toàn cầu có tín hiệu hạ nhiệt|https://vnexpress.net/lam-phat-toan-cau-co-tin-hieu-ha-nhiet-4473214.html|https://i1-kinhdoanh.vnecdn.net/2022/06/07/sjhpcptrb5kovnft3cd5bwi5ey-jpe-2055-3463-1654591457.jpg?w=220&h=132&q=100&dpr=1&fit=crop&s=7wZK_ZcMXhHOk9_VfaulZA|Ba yếu tố quan trọng về nguồn cung có dấu hiệu bớt căng thẳng, mở ra hy vọng giảm tốc cho lạm phát toàn cầu.|kinh tế|vnexpress.net|unknow
PAN huy động hơn 1.500 tỷ đồng để thâu tóm nhiều công ty|https://vnexpress.net/pan-huy-dong-hon-1-500-ty-dong-de-thau-tom-nhieu-cong-ty-4473099.html|https://i1-kinhdoanh.vnecdn.net/2022/06/07/day-chuyen-san-xuat-tom-tai-fm-1929-6956-1654573789.jpg?w=220&h=132&q=100&dpr=1&fit=crop&s=nHGr_fnV1hv0rFA6ZWA1eA|Công ty cổ phần Tập đoàn PAN dự kiến thu về hơn 1.500 tỷ đồng qua phát hành cổ phiếu để thâu tóm nhiều công ty nông nghiệp, thủy sản.|kinh tế|vnexpress.net|unknow
"Tư vấn chuyên gia | Nên đầu tư gì với 20 triệu đồng mỗi tháng?"|https://vnexpress.net/nen-dau-tu-gi-voi-20-trieu-dong-moi-thang-4470800.html|https://i1-kinhdoanh.vnecdn.net/2022/06/06/cg2a9238-1654502717-3679-1654503295.jpg?w=220&h=132&q=100&dpr=1&fit=crop&s=Rj1bW_5JLakS2hX_KdKrfg|Chuyên gia cho rằng chứng khoán là kênh phù hợp cho số vốn nhỏ và nên duy trì đầu tư đều đặn mỗi tháng vào các cổ phiếu giá trị.|kinh tế|vnexpress.net|unknow
Nguy cơ giao thương 'chia phe' tổn hại tăng trưởng toàn cầu|https://vnexpress.net/giao-thuong-chia-phe-nguy-co-ton-hai-tang-truong-toan-cau-4472753.html|https://i1-kinhdoanh.vnecdn.net/2022/06/06/5f3280faa3108348fce40adb-jpeg-7919-6580-1654507614.jpg?w=220&h=132&q=100&dpr=1&fit=crop&s=VPOlt4O_RRcF8k_99rTDjQ|Một số nhà kinh tế lo ngại việc chọn các đối tác thương mại vì lý do địa chính trị có thể khiến lạm phát tăng, tăng trưởng giảm.|kinh tế|vnexpress.net|unknow
Vietcombank miễn nhiều loại phí giao dịch cho doanh nghiệp SME|https://vnexpress.net/vietcombank-mien-nhieu-loai-phi-giao-dich-cho-doanh-nghiep-sme-4470772.html|https://i1-kinhdoanh.vnecdn.net/2022/06/07/anh-2-1654074329-1988-1654596681.png?w=220&h=132&q=100&dpr=1&fit=crop&s=BKCO5tRJWhFzN1IbKetqrg|Khách hàng doanh nghiệp vừa và nhỏ (SME) được tặng tài khoản số đẹp, miễn phí giao dịch trên ngân hàng số VCB DigiBiz, tại quầy... khi đăng ký gói giao dịch từ 1/6.|kinh tế|vnexpress.net|unknow
Chứng chỉ quỹ là gì?|https://vnexpress.net/chung-chi-quy-la-gi-4471636.html|https://i1-kinhdoanh.vnecdn.net/2022/06/03/finance-4858797-1280-2-1024x58-7241-8422-1654233327.jpg?w=220&h=132&q=100&dpr=1&fit=crop&s=23Q5LHYfdOTFJeqWUYolig|Nhà đầu tư mua chứng chỉ quỹ đồng nghĩa với việc ủy thác vốn cho các tổ chức quản lý quỹ.|kinh tế|vnexpress.net|unknow
Tắc nghẽn container có thể cao hơn năm 2021|https://vnexpress.net/tac-nghen-container-co-the-cao-hon-nam-2021-4470063.html|https://i1-kinhdoanh.vnecdn.net/2022/05/31/containerschiffgreenoakadobest-2894-3927-1653966199.jpg?w=220&h=132&q=100&dpr=1&fit=crop&s=vTGJ84DL6UZFZ2BGfn_8jw|Nhiều thương nhân và công ty vận tải lo ngại sự hỗn loạn trong vận chuyển container mùa cao điểm sắp tới thậm chí lớn hơn so với năm 2021.|kinh tế|vnexpress.net|unknow
Chiều nay chuyên gia trả lời trực tuyến về đầu tư bất động sản|https://vnexpress.net/chieu-nay-chuyen-gia-tra-loi-truc-tuyen-ve-dau-tu-bat-dong-san-4473017.html|https://i1-kinhdoanh.vnecdn.net/2022/06/07/218-1654566998-7145-1654567045.jpg?w=220&h=132&q=100&dpr=1&fit=crop&s=pqyNxLcNchKWGIYQ9f99xA|Chuyên gia có 20 năm kinh nghiệm sẽ giải đáp thắc mắc của khan giả về đầu tư bất động sản lúc 14h30, ngày 7/6.|kinh tế|vnexpress.net|unknow
Doanh thu Petrovietnam vượt 63% kế hoạch 5 tháng|https://vnexpress.net/doanh-thu-petrovietnam-vuot-63-ke-hoach-5-thang-4472875.html|https://i1-kinhdoanh.vnecdn.net/2022/06/06/22-1654517626-5514-1654517729.png?w=220&h=132&q=100&dpr=1&fit=crop&s=jqp7Astd3w5p-JcZ3GNYwA|Tổng doanh thu toàn tập đoàn ước đạt 372,2 nghìn tỷ đồng đạt 67% kế hoạch cả năm.|kinh tế|vnexpress.net|unknow
Giá trần, giá sàn trong chứng khoán là gì?|https://vnexpress.net/gia-tran-gia-san-trong-chung-khoan-la-gi-4471783.html|https://i1-kinhdoanh.vnecdn.net/2022/06/03/fortuneindia-2022-01-c841f737-8556-7166-1654247400.jpg?w=220&h=132&q=100&dpr=1&fit=crop&s=EgFaKHR3sI6U_c_CE35_4Q|Giá trần và giá sàn là mức giá cao nhất và thấp nhất có thể đặt lệnh giao dịch trong phiên.|kinh tế|vnexpress.net|unknow
3 yếu tố hút giới siêu giàu của dinh thự Elie Saab|https://vnexpress.net/3-yeu-to-hut-gioi-sieu-giau-cua-dinh-thu-elie-saab-4470350.html|https://i1-kinhdoanh.vnecdn.net/2022/06/03/Settop-1654244805-7735-1654244843.jpg?w=220&h=132&q=100&dpr=1&fit=crop&s=1q5yfYWyQbNCfJgLzhbduw|Số lượng giới hạn, các dấu ấn độc bản, giá trị cảm xúc là những yếu tố khiến dinh thự mang thương hiệu Elie Saab thu hút giới thượng lưu.|kinh tế|vnexpress.net|unknow
Khác biệt giữa bảo hiểm nhân thọ và bảo hiểm tổng quát|https://vnexpress.net/khac-biet-giua-bao-hiem-nhan-tho-va-bao-hiem-tong-quat-4472666.html|https://i1-kinhdoanh.vnecdn.net/2022/06/06/diffreence-between-li-and-gi-1-7880-4937-1654492040.png?w=220&h=132&q=100&dpr=1&fit=crop&s=Xh-TyzSxCRNvB_63T8UM9Q|Bảo hiểm nhân thọ chỉ bảo vệ sinh mạng của người mua còn bảo hiểm tổng quát chịu trách nhiệm cho mọi tổn thất tài sản được bảo hiểm của khách hàng như nhà, xe...|kinh tế|vnexpress.net|unknow
Bộ Tài chính: Thị trường chứng khoán bị ảnh hưởng nhiều bởi tâm lý|https://vnexpress.net/bo-tai-chinh-thi-truong-chung-khoan-bi-anh-huong-nhieu-boi-tam-ly-4472692.html|https://i1-kinhdoanh.vnecdn.net/2022/06/06/chungkhoan22022-1654507249-4443-1654507300.jpg?w=220&h=132&q=100&dpr=1&fit=crop&s=kRQ5r5lyWKTkp95Y_iRanw|Thị trường cổ phiếu, chứng khoán phái sinh có hiện tượng thao túng giá, làm giá ngày càng tinh vi và bị ảnh hưởng nhiều bởi tin đồn, theo Bộ Tài chính.|kinh tế|vnexpress.net|unknow
Mỹ cân nhắc dỡ bỏ một số thuế quan với hàng hoá Trung Quốc|https://vnexpress.net/my-can-nhac-do-bo-mot-so-thue-quan-voi-hang-hoa-trung-quoc-4472832.html|https://i1-kinhdoanh.vnecdn.net/2022/06/06/806x378usmullsliftingsomechina-4782-5599-1654508921.jpg?w=220&h=132&q=100&dpr=1&fit=crop&s=7rxzeXAsS0iBnU2DlpHmkA|Để chống lạm phát, Tổng thống Joe Biden đã yêu cầu xem xét lựa chọn dỡ bỏ một số thuế quan với hàng hoá Trung Quốc.|kinh tế|vnexpress.net|unknow
Cổ phiếu bất động sản giảm sâu|https://vnexpress.net/co-phieu-bat-dong-san-giam-sau-4472824.html|https://i1-kinhdoanh.vnecdn.net/2022/06/06/QUYN8396-1654508334-9168-1654508433.jpg?w=220&h=132&q=100&dpr=1&fit=crop&s=S-cANh_m2v7puqYU859_Zw|VN-Index chốt phiên 6/6 trong sắc xanh nhưng nhóm bất động sản bị bán tháo trên diện rộng, nhiều mã chạm sàn chỉ trong vài phút cuối phiên chiều.|kinh tế|vnexpress.net|unknow
Ngân hàng Nhà nước lo rủi ro lớn khi tín dụng chảy vào bất động sản|https://vnexpress.net/ngan-hang-nha-nuoc-lo-rui-ro-lon-khi-tin-dung-chay-vao-bat-dong-san-4472678.html|https://i1-kinhdoanh.vnecdn.net/2022/06/06/tiennganhangGiangHuy-165449448-8219-5091-1654494760.jpg?w=220&h=132&q=100&dpr=1&fit=crop&s=XFRcL1YTZymKl7I05_937Q|94% dư nợ bất động sản là cho vay trung, dài hạn, trong khi nguồn huy động của ngân hàng chủ yếu là ngắn hạn nên Thống đốc đánh giá đây có thể là một rủi ro.|kinh tế|vnexpress.net|unknow
Lý do giá dầu sẽ tiếp tục ở mức cao|https://vnexpress.net/ly-do-gia-dau-se-tiep-tuc-o-muc-cao-4472567.html|https://i1-kinhdoanh.vnecdn.net/2022/06/06/oilAP-1654491154-2496-1654491199.jpg?w=220&h=132&q=100&dpr=1&fit=crop&s=vBqkih-wnRYFuMKklOlThg|Giá dầu vài ngày gần đây có xu hướng tăng, tiến sát mốc khi xung đột Nga - Ukraine mới bắt đầu và chưa có dấu hiệu sớm hạ nhiệt.|kinh tế|vnexpress.net|unknow
Tiểu thương chợ nguyên liệu may mặc lớn nhất TP HCM xin ngừng bán|https://vnexpress.net/tieu-thuong-cho-nguyen-lieu-may-mac-lon-nhat-tp-hcm-xin-ngung-ban-4471690.html|https://i1-kinhdoanh.vnecdn.net/2022/06/03/tieu-thuong-1654245047-1369-1654247092.jpg?w=220&h=132&q=100&dpr=1&fit=crop&s=5XsgzwG7_7cK7hhCzJrSLw|138/150 tiểu thương chợ Đại Quang Minh đã xin tạm ngưng kinh doanh để phản đối việc Satraseco đơn phương tăng gấp đôi giá thuê sạp.|kinh tế|vnexpress.net|unknow
